category,subcategory,name,specification,text message,option 1,option 2,option 3,option 4,option 5,option 6,option 7,option 8,option 9,option 10,name of flow,flow id,node id
Content,Relax,CheckIn,Anger management,Hi! We would love to check in with how you are doing! Have you managed to keep calm whenever you get angry over the past few days? ,Yes,No,,,,,,,,,PLH - Content - Relax - CheckIn - Anger management,1be94fa5-1996-4977-8eff-a5259c8e9364,ca02de40-9ea5-4cc9-8dd2-9ad961ce0144
Content,Relax,CheckIn,Anger management,"Sorry, I don't understand what you mean.",,,,,,,,,,,PLH - Content - Relax - CheckIn - Anger management,1be94fa5-1996-4977-8eff-a5259c8e9364,8711c02e-9839-40c4-91a6-6382378ecb6f
Content,Relax,CheckIn,Anger management,"Great job! You should be proud of yourself! Research shows that every time you control your anger in front of your child, you increase your child's brain development.",,,,,,,,,,,PLH - Content - Relax - CheckIn - Anger management,1be94fa5-1996-4977-8eff-a5259c8e9364,1c138438-97e9-4807-8e80-09bf9adc527a
Content,Relax,CheckIn,Anger management,Would you like to review the content?,Yes,No,,,,,,,,,PLH - Content - Relax - CheckIn - Anger management,1be94fa5-1996-4977-8eff-a5259c8e9364,c2fcf601-978f-461e-8dae-22f5c51b5b96
Content,Relax,CheckIn,Anger management,"Sorry to hear that you are finding this challenging. If you are getting angry because your baby won’t stop crying, it’s OK to leave them on their back in a safe location, like a crib, and walk away for a bit. Check on your baby every 5-10 minutes.",,,,,,,,,,,PLH - Content - Relax - CheckIn - Anger management,1be94fa5-1996-4977-8eff-a5259c8e9364,e10b1a9a-7b5c-4f56-a75b-03f2019866b9
Content,Relax,CheckIn,Anger management,"It is completely normal to experience this challenge. Next time you feel yourself getting angry try to manage this by taking deep breaths in. This can allow you to relax and reduce stress, which can help with managing your emotions. Every time you do this, you increase your child's brain development!",,,,,,,,,,,PLH - Content - Relax - CheckIn - Anger management,1be94fa5-1996-4977-8eff-a5259c8e9364,2b63c930-000f-4a98-9485-9a2917f0c15c
Content,Relax,CheckIn,Anger management,"Sorry, I don't understand what you mean.",,,,,,,,,,,PLH - Content - Relax - CheckIn - Anger management,1be94fa5-1996-4977-8eff-a5259c8e9364,2df89f4c-bbcc-4e71-b3ea-0bb17169ea51
Content,Relax,CheckIn,Anger management,"That is okay! Remember you can access parenting content at anytime by typing ""Help"". Chat to you later!",,,,,,,,,,,PLH - Content - Relax - CheckIn - Anger management,1be94fa5-1996-4977-8eff-a5259c8e9364,58c37c6d-00ee-4384-b978-b2f1fb82c520