category,subcategory,name,specification,text message,option 1,option 2,option 3,option 4,option 5,option 6,option 7,option 8,option 9,option 10,name of flow,flow id,node id
Content,Relax,CheckIn,Connect,Hi! How are you feeling?,Great,Okay,Bad,,,,,,,,PLH - Content - Relax - CheckIn - Connect,cea340b6-26d5-4a76-b4db-f402d97c44c2,9b8b4c00-1064-4616-b16d-a1ca86e8140d
Content,Relax,CheckIn,Connect,"Sorry, I don't understand what you mean.",,,,,,,,,,,PLH - Content - Relax - CheckIn - Connect,cea340b6-26d5-4a76-b4db-f402d97c44c2,42ca4751-587b-4c81-92bf-e739ab4dbf06
Content,Relax,CheckIn,Connect,Sorry to hear that you are not having a good day. It is completely normal to be going through a difficult time now. Remember that you are not alone.,,,,,,,,,,,PLH - Content - Relax - CheckIn - Connect,cea340b6-26d5-4a76-b4db-f402d97c44c2,36dc38a5-a83b-48e3-97df-29ac03444afe
Content,Relax,CheckIn,Connect,So good to hear that you are doing well. What a wonderful feeling!,,,,,,,,,,,PLH - Content - Relax - CheckIn - Connect,cea340b6-26d5-4a76-b4db-f402d97c44c2,9e3822fa-fb3c-4db7-bfab-17f8640c59a5
Content,Relax,CheckIn,Connect,Sometimes we're up. Sometimes we're down. And sometimes we are neither up nor down...and that's totally okay!,,,,,,,,,,,PLH - Content - Relax - CheckIn - Connect,cea340b6-26d5-4a76-b4db-f402d97c44c2,12704df4-3d0d-4c92-b5a2-08d7a82866c8
Content,Relax,CheckIn,Connect,"When you take care of yourself, you take care of your children. We all need to connect. Try to talk to friends, family, and other support networks every day. If it has been a while since you reached out to someone, do it now!",,,,,,,,,,,PLH - Content - Relax - CheckIn - Connect,cea340b6-26d5-4a76-b4db-f402d97c44c2,b8a3f9f3-edf4-42d9-806a-5ca9c9588d67